<?xml version='1.0' encoding='utf-8'?>
<orders xmlns:xsi="http://www.w3.org/2001/XMLSchema-instance" batch_id="4" xsi:noNamespaceSchemaLocation="../orders.xsd">
  <version>2</version>
  <shiporder orderid="3" processed_at="2023-09-11T18:27:56.000+02:00">
    <orderperson name="billing">
      <name>Alice</name>
      <address>string</address>
      <city>string</city>
      <zip codingSystem="int">21093</zip>
      <country>US</country>
    </orderperson>
    <shipto name="shipping">
      <name>Bob</name>
      <address>string</address>
      <city>string</city>
      <zip codingSystem="us">102832</zip>
      <country>FR</country>
      <phoneNumber>+1732897354</phoneNumber>
      <phoneNumber>+1732323984</phoneNumber>
      <companyId>
        <bic>JIDAZIO786DAZH</bic>
      </companyId>
      <coordinates>48.87271337163929 2.323433844198471</coordinates>
      <a_very_long_field_type_that_makes_col_name_exceeds_max_identifier_length>test</a_very_long_field_type_that_makes_col_name_exceeds_max_identifier_length>
    </shipto>
    <item>
      <product>
        <name>product 1</name>
        <version>premium</version>
      </product>
      <quantity>10</quantity>
      <price>12.3</price>
      <currency>EUR</currency>
      <delivery>
        <from name="warehouse">
          <name>Warehouse A</name>
          <address>1 Depot Road</address>
          <city>Lyon</city>
          <zip codingSystem="int">69001</zip>
          <country>FR</country>
        </from>
        <to name="shipping">
          <name>Bob</name>
          <address>string</address>
          <city>string</city>
          <zip codingSystem="us">102832</zip>
          <country>FR</country>
        </to>
      </delivery>
      <detail>
        <weight>12.5</weight>
        <unit>kg</unit>
      </detail>
      <detail>
        <weight>0.8</weight>
        <unit>m3</unit>
      </detail>
    </item>
    <item>
      <product>
        <name>product 1</name>
        <version>premium</version>
      </product>
      <note>string</note>
      <quantity>21</quantity>
      <price>70.4</price>
      <currency>EUR</currency>
      <delivery>
        <to name="shipping">
          <name>Alice</name>
          <address>string</address>
          <city>string</city>
          <zip codingSystem="int">21093</zip>
          <country>US</country>
        </to>
      </delivery>
    </item>
    <detail>
      <reference>BL-2023-45</reference>
      <carrier>Acme Transport</carrier>
    </detail>
    <carrierId>
      <vat>FR40303265045</vat>
      <registry>RCS Lyon</registry>
    </carrierId>
  </shiporder>
</orders>
