<?xml version='1.0' encoding='utf-8'?>
<orders xmlns:xsi="http://www.w3.org/2001/XMLSchema-instance" batch_id="5" xsi:noNamespaceSchemaLocation="../orders.xsd">
  <version>2</version>
  <shiporder orderid="1" processed_at="2023-09-10T09:37:00.000+02:00  ">
    <orderperson name="billing">
      <name>    Bob    </name>
      <address>string</address>
      <city>string</city>
      <zip codingSystem="us">102832</zip>
      <country>FR</country>
      <phoneNumber>+1732897354</phoneNumber>
      <phoneNumber>+1732323984</phoneNumber>
      <companyId>
        <bic>JIDAZIO786DAZH</bic>
      </companyId>
      <extra source="crm">
        <profileName>profile 1</profileName>
      </extra>
    </orderperson>
    <item>
      <product>
        <name>
          product 1
        </name>
        <version>regular</version>
        <related_product>
          <name>
            product 1
          </name>
          <version>premium</version>
        </related_product>
        <related_product>
          <name>
            product 1
          </name>
          <version>basic</version>
        </related_product>
      </product>
      <quantity>13</quantity>
      <price>
        340.23
      </price>
      <currency>EUR</currency>
    </item>
    <item>
      <product>
        <name>product 2</name>
        <version>regular</version>
      </product>
      <note>string</note>
      <comment>this comment should be skipped</comment>
      <quantity>8</quantity>
      <price>56.2</price>
      <currency>EUR</currency>
    </item>
    <item>
      <product>
        <name>product 1</name>
        <version>premium</version>
      </product>
      <quantity>  25</quantity>
      <price>21.7</price>
      <currency>EUR</currency>
    </item>
  </shiporder>
</orders>
